### ISSUE TITLE
SO_LINGER: close() blocks forever when remote closes the connection first and local side has unacked data but no unsent data

### ISSUE THREAD

**Issue by MattiasTF** [espressif/esp-lwip#84]
### Checklist

- [x] Checked the issue tracker for similar issues to ensure this is not a duplicate
- [x] Read the documentation to confirm the issue is not addressed there and your configuration is set correctly
- [x] Tested with the latest version to ensure the issue hasn't been fixed

### How often does this bug occurs?

always

### Expected behavior

Calling `close()` on a TCP socket that has `SO_LINGER` enabled should return within the linger time or shortly after the time expires.

### Actual behavior (suspected bug)

The `close()` call will block forever when the remote side closed the connection first and local side has unacked data but no unsent data.

### Error logs or terminal output

```shell
See "Additional context" below.
```

### Steps to reproduce the behavior

See "Additional context" below.

### Project release version

2.2.0-esp branch

### System architecture

other (details in Additional context)

### Operating system

Linux

### Operating system version

IDF 5.5.1

### Shell

other (details in Additional context)

### Additional context

The handling of SO_LINGER seems to be suffering from a lost wake-up issue when the connection is closed by the remote side first and the local side has unacked data but no unsent data. Hitting this case can be tricky, but it’s rather common when closing a WebSocket connection that is connected to the ESP’s web server.

1. Browser sends WebSocket close frame.
2. Browser sends TCP FIN.
3. ESP receives WebSocket close frame.
4. ESP closes connection.
5. ESP receives TCP FIN.

Depending on the state of ESP’s send buffers, three cases are possible. Note that the packet capture timestamps are for the browser side of the connection. The RTT between browser and ESP is > 15 ms.

### Case A: Close with no unsent data and no unacked data

```
00:00:09.513 IP browser.50185 > esp.80: Flags [P.], seq 190:196, ack 43785, win 65535, length 6: HTTP
00:00:09.515 IP browser.50185 > esp.80: Flags [F.], seq 196, ack 43785, win 65535, length 0
00:00:09.548 IP esp.80 > browser.50185: Flags [.], ack 197, win 5564, length 0
00:00:09.566 IP esp.80 > browser.50185: Flags [F.], seq 43785, ack 197, win 5564, length 0
00:00:09.569 IP browser.50185 > esp.80: Flags [.], ack 43786, win 65535, length 0
```

1. Browser sends WebSocket close frame.
2. Browser sends TCP FIN.
3. ESP acks close frame and closes the socket.
4. ESP acks browser FIN and sends its own FIN.
5. Browser acks FIN.

When closing the socket, lwIP executes `lwip_netconn_do_close_internal`, which sees that the close is finished and [posts](https://github.com/espressif/esp-lwip/blob/e9b8482e75577c4af581b213a38f7e1970c9b888/src/api/api_msg.c#L1135) the `op_completed_sem` semaphore to release the calling process and everything is fine.

### Case B: Close with unsent data

```
00:00:05.609 IP browser.50655 > esp.80: Flags [P.], seq 166:172, ack 38136, win 65535, length 6: HTTP
00:00:05.612 IP browser.50655 > esp.80: Flags [F.], seq 172, ack 38136, win 65535, length 0
00:00:05.627 IP esp.80 > browser.50655: Flags [P.], seq 38136:38138, ack 166, win 5595, length 2: HTTP
00:00:05.641 IP browser.50655 > esp.80: Flags [.], ack 38138, win 65533, length 0
00:00:05.646 IP esp.80 > browser.50655: Flags [FP.], seq 38138:38243, ack 173, win 5588, length 105: HTTP
00:00:05.661 IP browser.50655 > esp.80: Flags [.], ack 38244, win 65428, length 0
```

1. Browser sends WebSocket close frame.
2. Browser sends TCP FIN.
3. Data from the ESP arrives, which was sent before the FIN arrived.
4. Browser acks data.
5. ESP closes the connection and sends final data with piggy-backed FIN.
6. Browser acks final data and FIN.

- In this case, `lwip_netconn_do_close_internal` sees that the connection has not finished closing yet and reinstalls the callbacks for `sent_tcp`, `poll_tcp` and `err_tcp`.
- When the packet from step 4 arrives, `tcp_input` sees that some data was acked and [calls](https://github.com/espressif/esp-lwip/blob/e9b8482e75577c4af581b213a38f7e1970c9b888/src/core/tcp_in.c#L479) `sent_tcp`, which [calls](https://github.com/espressif/esp-lwip/blob/e9b8482e75577c4af581b213a38f7e1970c9b888/src/api/api_msg.c#L422) `lwip_netconn_do_close_internal`, which sees that the connection has still not finished closing yet and reinstalls the callbacks again.
- When the packet from step 6 arrives, `tcp_input` sees that some data was acked and calls `sent_tcp` and thus `lwip_netconn_do_close_internal`, which sees that the connection *has* finished closing and posts the `op_completed_sem` semaphore to release the calling process and everything is fine.

### Case C: Close with unacked data but no unsent data

```
00:00:05.645 IP browser.50129 > esp.80: Flags [P.], seq 166:172, ack 37661, win 65535, length 6: HTTP
00:00:05.646 IP browser.50129 > esp.80: Flags [F.], seq 172, ack 37661, win 65535, length 0
00:00:05.660 IP esp.80 > browser.50129: Flags [P.], seq 37661:37771, ack 166, win 5595, length 110: HTTP
00:00:05.674 IP browser.50129 > esp.80: Flags [.], ack 37771, win 65425, length 0
00:00:05.675 IP esp.80 > browser.50129: Flags [.], ack 173, win 5588, length 0
00:00:05.688 IP esp.80 > browser.50129: Flags [F.], seq 37771, ack 173, win 5588, length 0
00:00:05.689 IP browser.50129 > esp.80: Flags [.], ack 37772, win 65425, length 0
```

1. Browser sends WebSocket close frame.
2. Browser sends TCP FIN.
3. Data from the ESP arrives, which was sent before the FIN arrived.
4. Browser acks data.
5. ESP acks close frame and closes the socket.
6. ESP acks browser FIN and sends its own FIN, receives the ACK from step 4 around here.
7. Browser acks FIN.

- In this case, the ESP receives the WebSocket close frame and closes its socket before it has received the ACK for the last data.
- When the ACK from step 4 arrives, `tcp_input` sees that some data was acked and runs, `tcp_sent` and thus `lwip_netconn_do_close_internal`, which sees that the connection has still not finished closing yet and reinstalls the callbacks.
- When the ACK from step 7 arrives, `tcp_input` doesn't see any data acked (the ESP’s FIN had none) and *does not run* `tcp_sent` and `lwip_netconn_do_close_internal`. Therefore, the `op_completed_sem` semaphore is never posted and the calling process is not released.
- The connection's PCB is removed as usual because the connection has been closed correctly, so `tcp_poll` is never called for the connection.
- The calling process is now stuck forever.

The problem is that the final packet that the browser has to ack does not carry any data, so the arrival of that ACK doesn't trigger the check for a completed connection, which would post the semaphore. In case B, the final packet that the browser has to ack *does* carry data, so the arrival of that ACK does trigger the check and semaphore post.

### Possible fix

The hung `close()` call in case C can be fixed by calling `tcp_sent` from `tcp_input` when the connection is in LAST_ACK state, even when no data was acked. A possible patch for that can be found [here](https://gist.github.com/MattiasTF/7b37e0c52068b9af69ab86668a262e82). I’m not sure if this is the correct solution, which is why I haven’t opened a pull request yet. I can open a PR is this fix is acceptable.
